make[1]: Entering directory `$(@D)'
(cd tests && ./TESTrun.sh)
    esp1                          : TEST SKIPPED (compiled w/o OpenSSL)
    esp2                          : TEST SKIPPED (compiled w/o OpenSSL)
    esp3                          : TEST SKIPPED (compiled w/o OpenSSL)
    esp4                          : TEST SKIPPED (compiled w/o OpenSSL)
    esp5                          : TEST SKIPPED (compiled w/o OpenSSL)
    espudp1                       : TEST SKIPPED (compiled w/o OpenSSL)
    ikev2pI2                      : TEST SKIPPED (compiled w/o OpenSSL)
    isakmp4                       : TEST SKIPPED (compiled w/o OpenSSL)
    lmp-v                         : passed
    nflog-e                       : TEST SKIPPED (compiled w/o NFLOG)
    print-x                       : passed
    print-xx                      : passed
    print-X                       : passed
    print-XX                      : passed
    print-A                       : passed
    print-AA                      : passed
    bgp_vpn_attrset               : passed
    mpbgp-linklocal-nexthop       : passed
    bgp_infloop-v                 : passed
    eapon1                        : passed
    esp0                          : passed
    isakmp1                       : passed
    isakmp2                       : passed
    isakmp3                       : passed
    isakmp5-v                     : passed
    lmp                           : passed
    mpls-ldp-hello                : passed
    ldp_infloop                   : passed
    ospf-gmpls                    : passed
    ospf3_ah-vv                   : passed
    ospf3_auth-vv                 : passed
    ospf3_bc-vv                   : passed
    ospf3_mp-vv                   : passed
    ospf3_nbma-vv                 : passed
    ikev2four                     : passed
    ikev2fourv                    : passed
    ikev2fourv4                   : passed
    dio02                         : passed
    dio03                         : passed
    dao01                         : passed
    daoack01                      : passed
    e1000g                        : passed
    forces01                      : passed
    forces01vvv                   : passed
    forces01vvvv                  : passed
    qinq                          : passed
    qinqv                         : passed
    sflow1                        : passed
    sflow2                        : passed
    ahcp-vv                       : passed
    babel1                        : passed
    babel1v                       : passed
    babel_auth                    : passed
    babel_pad1                    : passed
    babel_rtt                     : passed
    pppoe                         : passed
    pppoes                        : passed
    pppoes_id                     : passed
    igmpv1                        : passed
    igmpv2                        : passed
    igmpv3-queries                : passed
    mtrace                        : passed
    dvmrp                         : passed
    icmpv6                        : passed
    icmpv6_opt24-v                : passed
    spb                           : passed
    spb_bpduv4                    : passed
    dcb_ets                       : passed
    dcb_pfc                       : passed
    dcb_qcn                       : passed
    evb                           : passed
    mstp-v                        : passed
    stp-v                         : passed
    rstp-v                        : passed
    rpvst-v                       : passed
    ripv1v2                       : passed
    ripv2_auth                    : passed
    dhcpv6-aftr-name              : passed
    dhcpv6-ia-na                  : passed
    dhcpv6-ia-pd                  : passed
    dhcpv6-ia-ta                  : passed
    dhcpv6-ntp-server             : passed
    dhcpv6-sip-server-d           : passed
    dhcpv6-domain-list            : passed
    zmtp1v                        : passed
    pgmv                          : passed
    epgmv                         : passed
    pgm_zmtp1v                    : passed
    epgm_zmtp1v                   : passed
    msnlb                         : passed
    msnlb2                        : passed
    mptcp                         : passed
    mptcp-fclose                  : passed
    tfo                           : passed
    802.11_exthdr                 : passed
    802.11_rx-stbc                : passed
    of10_p3295-vv                 : passed
    of10_s4810-vvvv               : passed
    of10_pf5240-vv                : passed
    of10_7050q-v                  : passed
    of10_7050sx_bsn-vv            : passed
    geonet-calm-fast              : passed
    m3ua                          : passed
    m3ua-vv                       : passed
    syslog-v                      : passed
    ipv6-bad-version.pcap         : passed
    ipv6-routing-header           : passed
    loopback                      : passed
    dccp_partial_csum_v4_simple   : passed
    dccp_partial_csum_v4_longer   : passed
    dccp_partial_csum_v6_simple   : passed
    dccp_partial_csum_v6_longer   : passed
    vrrp                          : passed
    vrrp-v                        : passed
    hsrp_1                        : passed
    hsrp_1-v                      : passed
    hsrp_2-v                      : passed
    hsrp_3-v                      : passed
    pimv2_dm-v                    : passed
    pimv2_register-v              : passed
    pimv2_sm-v                    : passed
    pimv2_bootstrap-v             : passed
    pimv2_hellos-v                : passed
    isis_infloop-v                : passed
    rsvp_infloop-v                : passed
    hdlc1                         : passed
    hdlc2                         : passed
    hdlc3                         : passed
    hdlc4                         : passed
    decnet                        : passed
    radius-v                      : passed
    radius-rfc4675                : passed
    radius-rfc5176                : passed
    dtp-v                         : passed
    lacp-ev                       : passed
    lldp_cdp-ev                   : passed
    cdp-v                         : passed
    udld-v                        : passed
    eigrp1-v                      : passed
    eigrp2-v                      : passed
    eigrp3-v                      : passed
    eigrp4-v                      : passed
    isis_1                        : passed
    isis_1-v                      : passed
    isis_2-v                      : passed
    isis_3-v                      : passed
    isis_4-v                      : passed
    aoe_1                         : passed
    aoe_1-v                       : passed
    geneve-v                      : passed
    geneve-vni                    : TEST FAILED
    geneve-tcp                    : TEST FAILED
    dhcp-rfc3004                  : passed
    dhcp-rfc5859                  : passed
    kday1                         : passed
    kday2                         : passed
    kday3                         : passed
    kday4                         : passed
    kday5                         : passed
    kday6                         : passed
    kday7                         : passed
    kday8                         : passed
    cve2015-0261_01               : passed
    cve2015-0261_02               : passed
------------------------------------------------
   2 tests failed
 155 tests passed


Failed test: geneve-vni

1,20c1
< IP 20.0.0.2.50525 > 20.0.0.1.6081: Geneve, Flags [none], vni 0xb: IP 30.0.0.2 > 30.0.0.1: ICMP echo reply, id 10578, seq 23, length 64
< IP 20.0.0.2.43443 > 20.0.0.1.6081: Geneve, Flags [none], vni 0xb: IP 30.0.0.2.51225 > 30.0.0.1.22: Flags [S], seq 397610159, win 14600, options [mss 1460,sackOK,TS val 2876069566 ecr 0,nop,wscale 7], length 0
< IP 20.0.0.2.43443 > 20.0.0.1.6081: Geneve, Flags [none], vni 0xb: IP 30.0.0.2.51225 > 30.0.0.1.22: Flags [.], ack 2910871523, win 115, options [nop,nop,TS val 2876069566 ecr 84248969], length 0
< IP 20.0.0.2.43443 > 20.0.0.1.6081: Geneve, Flags [none], vni 0xb: IP 30.0.0.2.51225 > 30.0.0.1.22: Flags [.], ack 40, win 115, options [nop,nop,TS val 2876069573 ecr 84248971], length 0
< IP 20.0.0.2.43443 > 20.0.0.1.6081: Geneve, Flags [none], vni 0xb: IP 30.0.0.2.51225 > 30.0.0.1.22: Flags [P.], seq 0:21, ack 40, win 115, options [nop,nop,TS val 2876069573 ecr 84248971], length 21
< IP 20.0.0.2.43443 > 20.0.0.1.6081: Geneve, Flags [none], vni 0xb: IP 30.0.0.2.51225 > 30.0.0.1.22: Flags [P.], seq 21:813, ack 40, win 115, options [nop,nop,TS val 2876069573 ecr 84248971], length 792
< IP 20.0.0.2.43443 > 20.0.0.1.6081: Geneve, Flags [none], vni 0xb: IP 30.0.0.2.51225 > 30.0.0.1.22: Flags [P.], seq 813:837, ack 1024, win 130, options [nop,nop,TS val 2876069574 ecr 84248971], length 24
< IP 20.0.0.2.43443 > 20.0.0.1.6081: Geneve, Flags [none], vni 0xb: IP 30.0.0.2.51225 > 30.0.0.1.22: Flags [P.], seq 837:981, ack 1176, win 145, options [nop,nop,TS val 2876069577 ecr 84248972], length 144
< IP 20.0.0.2.43443 > 20.0.0.1.6081: Geneve, Flags [none], vni 0xb: IP 30.0.0.2.51225 > 30.0.0.1.22: Flags [P.], seq 981:997, ack 1896, win 161, options [nop,nop,TS val 2876069583 ecr 84248973], length 16
< IP 20.0.0.2.43443 > 20.0.0.1.6081: Geneve, Flags [none], vni 0xb: IP 30.0.0.2.51225 > 30.0.0.1.22: Flags [P.], seq 997:1045, ack 1896, win 161, options [nop,nop,TS val 2876069620 ecr 84248983], length 48
< IP 20.0.0.2.43443 > 20.0.0.1.6081: Geneve, Flags [none], vni 0xb: IP 30.0.0.2.51225 > 30.0.0.1.22: Flags [P.], seq 1045:1109, ack 1944, win 161, options [nop,nop,TS val 2876069621 ecr 84248983], length 64
< IP 20.0.0.2.43443 > 20.0.0.1.6081: Geneve, Flags [none], vni 0xb: IP 30.0.0.2.51225 > 30.0.0.1.22: Flags [.], ack 2008, win 161, options [nop,nop,TS val 2876069662 ecr 84248983], length 0
< IP 20.0.0.2.50525 > 20.0.0.1.6081: Geneve, Flags [none], vni 0xb: IP 30.0.0.2 > 30.0.0.1: ICMP echo reply, id 10578, seq 24, length 64
< IP 20.0.0.2.43443 > 20.0.0.1.6081: Geneve, Flags [none], vni 0xb: IP 30.0.0.2.51225 > 30.0.0.1.22: Flags [P.], seq 1109:1253, ack 2008, win 161, options [nop,nop,TS val 2876070845 ecr 84248983], length 144
< IP 20.0.0.2.43443 > 20.0.0.1.6081: Geneve, Flags [none], vni 0xb: IP 30.0.0.2.51225 > 30.0.0.1.22: Flags [.], ack 2040, win 161, options [nop,nop,TS val 2876070846 ecr 84249289], length 0
< IP 20.0.0.2.43443 > 20.0.0.1.6081: Geneve, Flags [none], vni 0xb: IP 30.0.0.2.51225 > 30.0.0.1.22: Flags [P.], seq 1253:1381, ack 2040, win 161, options [nop,nop,TS val 2876070846 ecr 84249289], length 128
< IP 20.0.0.2.43443 > 20.0.0.1.6081: Geneve, Flags [none], vni 0xb: IP 30.0.0.2.51225 > 30.0.0.1.22: Flags [P.], seq 1381:1829, ack 2088, win 161, options [nop,nop,TS val 2876070859 ecr 84249292], length 448
< IP 20.0.0.2.43443 > 20.0.0.1.6081: Geneve, Flags [none], vni 0xb: IP 30.0.0.2.51225 > 30.0.0.1.22: Flags [.], ack 2488, win 176, options [nop,nop,TS val 2876070861 ecr 84249292], length 0
< IP 20.0.0.2.43443 > 20.0.0.1.6081: Geneve, Flags [none], vni 0xb: IP 30.0.0.2.51225 > 30.0.0.1.22: Flags [.], ack 2568, win 176, options [nop,nop,TS val 2876071133 ecr 84249351], length 0
< IP 20.0.0.2.50525 > 20.0.0.1.6081: Geneve, Flags [none], vni 0xb: IP 30.0.0.2 > 30.0.0.1: ICMP echo reply, id 10578, seq 25, length 64
---
> EXIT CODE 00000100
Failed test: geneve-tcp

1,33c1
< IP 20.0.0.2.43443 > 20.0.0.1.6081: Geneve, Flags [none], vni 0xb: IP 30.0.0.2.51225 > 30.0.0.1.22: Flags [S], seq 397610159, win 14600, options [mss 1460,sackOK,TS val 2876069566 ecr 0,nop,wscale 7], length 0
< IP 20.0.0.1.22540 > 20.0.0.2.6081: Geneve, Flags [C], vni 0xa, options [8 bytes]: IP 30.0.0.1.22 > 30.0.0.2.51225: Flags [S.], seq 2910871522, ack 397610160, win 28960, options [mss 1460,sackOK,TS val 84248969 ecr 2876069566,nop,wscale 7], length 0
< IP 20.0.0.2.43443 > 20.0.0.1.6081: Geneve, Flags [none], vni 0xb: IP 30.0.0.2.51225 > 30.0.0.1.22: Flags [.], ack 1, win 115, options [nop,nop,TS val 2876069566 ecr 84248969], length 0
< IP 20.0.0.1.22540 > 20.0.0.2.6081: Geneve, Flags [C], vni 0xa, options [8 bytes]: IP 30.0.0.1.22 > 30.0.0.2.51225: Flags [P.], seq 1:40, ack 1, win 227, options [nop,nop,TS val 84248971 ecr 2876069566], length 39
< IP 20.0.0.2.43443 > 20.0.0.1.6081: Geneve, Flags [none], vni 0xb: IP 30.0.0.2.51225 > 30.0.0.1.22: Flags [.], ack 40, win 115, options [nop,nop,TS val 2876069573 ecr 84248971], length 0
< IP 20.0.0.2.43443 > 20.0.0.1.6081: Geneve, Flags [none], vni 0xb: IP 30.0.0.2.51225 > 30.0.0.1.22: Flags [P.], seq 1:22, ack 40, win 115, options [nop,nop,TS val 2876069573 ecr 84248971], length 21
< IP 20.0.0.1.22540 > 20.0.0.2.6081: Geneve, Flags [C], vni 0xa, options [8 bytes]: IP 30.0.0.1.22 > 30.0.0.2.51225: Flags [.], ack 22, win 227, options [nop,nop,TS val 84248971 ecr 2876069573], length 0
< IP 20.0.0.2.43443 > 20.0.0.1.6081: Geneve, Flags [none], vni 0xb: IP 30.0.0.2.51225 > 30.0.0.1.22: Flags [P.], seq 22:814, ack 40, win 115, options [nop,nop,TS val 2876069573 ecr 84248971], length 792
< IP 20.0.0.1.22540 > 20.0.0.2.6081: Geneve, Flags [C], vni 0xa, options [8 bytes]: IP 30.0.0.1.22 > 30.0.0.2.51225: Flags [.], ack 814, win 239, options [nop,nop,TS val 84248971 ecr 2876069573], length 0
< IP 20.0.0.1.22540 > 20.0.0.2.6081: Geneve, Flags [C], vni 0xa, options [8 bytes]: IP 30.0.0.1.22 > 30.0.0.2.51225: Flags [P.], seq 40:1024, ack 814, win 239, options [nop,nop,TS val 84248971 ecr 2876069573], length 984
< IP 20.0.0.2.43443 > 20.0.0.1.6081: Geneve, Flags [none], vni 0xb: IP 30.0.0.2.51225 > 30.0.0.1.22: Flags [P.], seq 814:838, ack 1024, win 130, options [nop,nop,TS val 2876069574 ecr 84248971], length 24
< IP 20.0.0.1.22540 > 20.0.0.2.6081: Geneve, Flags [C], vni 0xa, options [8 bytes]: IP 30.0.0.1.22 > 30.0.0.2.51225: Flags [P.], seq 1024:1176, ack 838, win 239, options [nop,nop,TS val 84248972 ecr 2876069574], length 152
< IP 20.0.0.2.43443 > 20.0.0.1.6081: Geneve, Flags [none], vni 0xb: IP 30.0.0.2.51225 > 30.0.0.1.22: Flags [P.], seq 838:982, ack 1176, win 145, options [nop,nop,TS val 2876069577 ecr 84248972], length 144
< IP 20.0.0.1.22540 > 20.0.0.2.6081: Geneve, Flags [C], vni 0xa, options [8 bytes]: IP 30.0.0.1.22 > 30.0.0.2.51225: Flags [P.], seq 1176:1896, ack 982, win 251, options [nop,nop,TS val 84248973 ecr 2876069577], length 720
< IP 20.0.0.2.43443 > 20.0.0.1.6081: Geneve, Flags [none], vni 0xb: IP 30.0.0.2.51225 > 30.0.0.1.22: Flags [P.], seq 982:998, ack 1896, win 161, options [nop,nop,TS val 2876069583 ecr 84248973], length 16
< IP 20.0.0.1.22540 > 20.0.0.2.6081: Geneve, Flags [C], vni 0xa, options [8 bytes]: IP 30.0.0.1.22 > 30.0.0.2.51225: Flags [.], ack 998, win 251, options [nop,nop,TS val 84248983 ecr 2876069583], length 0
< IP 20.0.0.2.43443 > 20.0.0.1.6081: Geneve, Flags [none], vni 0xb: IP 30.0.0.2.51225 > 30.0.0.1.22: Flags [P.], seq 998:1046, ack 1896, win 161, options [nop,nop,TS val 2876069620 ecr 84248983], length 48
< IP 20.0.0.1.22540 > 20.0.0.2.6081: Geneve, Flags [C], vni 0xa, options [8 bytes]: IP 30.0.0.1.22 > 30.0.0.2.51225: Flags [.], ack 1046, win 251, options [nop,nop,TS val 84248983 ecr 2876069620], length 0
< IP 20.0.0.1.22540 > 20.0.0.2.6081: Geneve, Flags [C], vni 0xa, options [8 bytes]: IP 30.0.0.1.22 > 30.0.0.2.51225: Flags [P.], seq 1896:1944, ack 1046, win 251, options [nop,nop,TS val 84248983 ecr 2876069620], length 48
< IP 20.0.0.2.43443 > 20.0.0.1.6081: Geneve, Flags [none], vni 0xb: IP 30.0.0.2.51225 > 30.0.0.1.22: Flags [P.], seq 1046:1110, ack 1944, win 161, options [nop,nop,TS val 2876069621 ecr 84248983], length 64
< IP 20.0.0.1.22540 > 20.0.0.2.6081: Geneve, Flags [C], vni 0xa, options [8 bytes]: IP 30.0.0.1.22 > 30.0.0.2.51225: Flags [P.], seq 1944:2008, ack 1110, win 251, options [nop,nop,TS val 84248983 ecr 2876069621], length 64
< IP 20.0.0.2.43443 > 20.0.0.1.6081: Geneve, Flags [none], vni 0xb: IP 30.0.0.2.51225 > 30.0.0.1.22: Flags [.], ack 2008, win 161, options [nop,nop,TS val 2876069662 ecr 84248983], length 0
< IP 20.0.0.2.43443 > 20.0.0.1.6081: Geneve, Flags [none], vni 0xb: IP 30.0.0.2.51225 > 30.0.0.1.22: Flags [P.], seq 1110:1254, ack 2008, win 161, options [nop,nop,TS val 2876070845 ecr 84248983], length 144
< IP 20.0.0.1.22540 > 20.0.0.2.6081: Geneve, Flags [C], vni 0xa, options [8 bytes]: IP 30.0.0.1.22 > 30.0.0.2.51225: Flags [P.], seq 2008:2040, ack 1254, win 264, options [nop,nop,TS val 84249289 ecr 2876070845], length 32
< IP 20.0.0.2.43443 > 20.0.0.1.6081: Geneve, Flags [none], vni 0xb: IP 30.0.0.2.51225 > 30.0.0.1.22: Flags [.], ack 2040, win 161, options [nop,nop,TS val 2876070846 ecr 84249289], length 0
< IP 20.0.0.2.43443 > 20.0.0.1.6081: Geneve, Flags [none], vni 0xb: IP 30.0.0.2.51225 > 30.0.0.1.22: Flags [P.], seq 1254:1382, ack 2040, win 161, options [nop,nop,TS val 2876070846 ecr 84249289], length 128
< IP 20.0.0.1.22540 > 20.0.0.2.6081: Geneve, Flags [C], vni 0xa, options [8 bytes]: IP 30.0.0.1.22 > 30.0.0.2.51225: Flags [P.], seq 2040:2088, ack 1382, win 276, options [nop,nop,TS val 84249292 ecr 2876070846], length 48
< IP 20.0.0.2.43443 > 20.0.0.1.6081: Geneve, Flags [none], vni 0xb: IP 30.0.0.2.51225 > 30.0.0.1.22: Flags [P.], seq 1382:1830, ack 2088, win 161, options [nop,nop,TS val 2876070859 ecr 84249292], length 448
< IP 20.0.0.1.22540 > 20.0.0.2.6081: Geneve, Flags [C], vni 0xa, options [8 bytes]: IP 30.0.0.1.22 > 30.0.0.2.51225: Flags [P.], seq 2088:2200, ack 1830, win 289, options [nop,nop,TS val 84249292 ecr 2876070859], length 112
< IP 20.0.0.1.22540 > 20.0.0.2.6081: Geneve, Flags [C], vni 0xa, options [8 bytes]: IP 30.0.0.1.22 > 30.0.0.2.51225: Flags [P.], seq 2200:2488, ack 1830, win 289, options [nop,nop,TS val 84249293 ecr 2876070859], length 288
< IP 20.0.0.2.43443 > 20.0.0.1.6081: Geneve, Flags [none], vni 0xb: IP 30.0.0.2.51225 > 30.0.0.1.22: Flags [.], ack 2488, win 176, options [nop,nop,TS val 2876070861 ecr 84249292], length 0
< IP 20.0.0.1.22540 > 20.0.0.2.6081: Geneve, Flags [C], vni 0xa, options [8 bytes]: IP 30.0.0.1.22 > 30.0.0.2.51225: Flags [P.], seq 2488:2568, ack 1830, win 289, options [nop,nop,TS val 84249351 ecr 2876070861], length 80
< IP 20.0.0.2.43443 > 20.0.0.1.6081: Geneve, Flags [none], vni 0xb: IP 30.0.0.2.51225 > 30.0.0.1.22: Flags [.], ack 2568, win 176, options [nop,nop,TS val 2876071133 ecr 84249351], length 0
---
> EXIT CODE 00000100


make[1]: *** [check] Error 2
make[1]: Leaving directory `$(@D)'
